{
  "productId": "sapata-u",
  "status": "active",
  "name": "Sapata U",
  "description": "Para tubos redondos com encaixe por pressão.",
  "category": { "slug": "sapata-u", "formatSlug": "u" },
  "seo": { "familySlug": "sapata-u" },
  "skuPrefix": "BF-SU",
  "sku": {
    "versionMarker": "V2",
    "parameterOrder": ["diametro", "espessura", "comprimento"],
    "parameterCodes": { "diametro": "DI", "espessura": "ES", "comprimento": "CO" },
    "colorCodes": { "Preto": "PR", "Branco": "BR", "Cinza": "CZ", "Marrom": "MR" }
  },
  "material": "TPU",
  "colors": ["Preto", "Branco", "Cinza", "Marrom"],
  "finishes": [],
  "leadTimeBaseDays": 5,
  "generationMode": "local_manual",
  "drawingType": "base-u",
  "ui": {
    "fixation": "encaixe por pressão",
    "summaryName": "Sapata U",
    "applications": ["estruturas metálicas", "mobiliário", "tubos redondos"]
  },
  "visuals": [
    { "role": "family", "src": "/products/final/sapata-u-family-v2.png", "alt": "Família de sapatas U em diferentes medidas, com e sem haste" },
    { "role": "product", "variantId": "sem-haste", "src": "/products/final/sapata-u-sem-haste-v2.png", "alt": "Sapata U sem haste em vista de produto final" },
    { "role": "product", "variantId": "haste", "src": "/products/final/sapata-u-com-haste-v2.png", "alt": "Sapata U com haste central em vista de produto final" },
    { "role": "manual", "src": "/products/final/manual-sapata-u-v2.png", "alt": "Sequência de instalação da sapata U por encaixe no tubo redondo" },
    { "role": "usage", "src": "/products/final/uso-sapata-u-v2.png", "alt": "Sapata U aplicada em estrutura tubular de mobiliário" }
  ],
  "notes": ["Modelos com e sem haste validados em CAD, fatiamento e cobertura de preço."],
  "parameters": [
    { "key": "diametro", "label": "Diâmetro externo do tubo", "type": "dimension", "unit": "mm", "min": 5, "max": 60, "step": 0.1, "default": 17.8, "role": "primary-width" },
    { "key": "espessura", "label": "Espessura da sapata", "type": "dimension", "unit": "mm", "min": 0.5, "max": 3, "step": 0.1, "default": 1.5, "role": "wall-thickness" },
    { "key": "comprimento", "label": "Comprimento da sapata", "type": "dimension", "unit": "mm", "min": 5, "max": 100, "step": 0.1, "default": 29.4, "role": "secondary-width" },
    { "key": "pescoco", "label": "Haste", "type": "boolean", "default": false, "role": "toggle" }
  ],
  "variants": [
    {
      "id": "sem-haste",
      "code": "SH",
      "public": true,
      "condition": { "pescoco": false },
      "cad": {
        "script": "Produtos/Scripts-GH/Sapata_U_SemHaste.gh",
        "modelVersion": "base-u-gh-v1",
        "sliderOrder": ["diametro", "comprimento", "espessura"],
        "technicalDefaults": { "topChamferMm": 0.8, "baseBottomChamferMm": 0.6, "meshToleranceMm": 0.15 }
      },
      "pricing": { "surfaceId": "sapata-u:u:sem-haste", "strategy": "sliced_dataset", "saleMultiplier": 4 }
    },
    {
      "id": "haste",
      "code": "HA",
      "public": true,
      "condition": { "pescoco": true },
      "cad": {
        "script": "Produtos/Scripts-GH/Sapata_U_ComHaste.gh",
        "modelVersion": "base-u-neck-gh-v1",
        "sliderOrder": ["diametro", "comprimento", "espessura"],
        "technicalDefaults": { "topChamferMm": 0.8, "baseBottomChamferMm": 0.6, "meshToleranceMm": 0.15 }
      },
      "pricing": { "surfaceId": "sapata-u:u:haste", "strategy": "sliced_dataset", "saleMultiplier": 4 }
    }
  ]
}
