{
  "productId": "sapata-lisa-quadrada",
  "status": "active",
  "name": "Lisa quadrada",
  "description": "Para bases planas com área de contato quadrada.",
  "category": { "slug": "sapata-base-lisa", "formatSlug": "quadrada" },
  "seo": { "familySlug": "sapata-lisa-quadrada" },
  "skuPrefix": "BF-BL-QD",
  "sku": {
    "versionMarker": "V2",
    "parameterOrder": ["tamanhoBaseX", "tamanhoBaseY", "alturaBase", "alturaPescoco", "diametroPescoco"],
    "parameterCodes": {
      "tamanhoBaseX": "BX",
      "tamanhoBaseY": "BY",
      "alturaBase": "AB",
      "alturaPescoco": "AP",
      "diametroPescoco": "DP"
    },
    "colorCodes": { "Preto": "PR", "Branco": "BR", "Cinza": "CZ", "Marrom": "MR" }
  },
  "material": "TPU",
  "colors": ["Preto", "Branco", "Cinza", "Marrom"],
  "finishes": [],
  "leadTimeBaseDays": 5,
  "generationMode": "local_manual",
  "drawingType": "base-rect",
  "ui": {
    "fixation": "apoio plano",
    "summaryName": "Lisa quadrada",
    "applications": ["chapa metálica", "banquinhos", "bases quadradas"]
  },
  "visuals": [
    { "role": "family", "src": "/products/final/sapata-lisa-quadrada-family.png", "alt": "Família de sapatas lisas quadradas em diferentes medidas e cores" },
    { "role": "variations", "src": "/products/final/sapata-lisa-quadrada-variados.png", "alt": "Variações de sapata lisa quadrada com e sem haste" },
    { "role": "product", "variantId": "sem-haste", "src": "/products/final/sapata-lisa-quadrada-sem-haste.png", "alt": "Sapata lisa quadrada sem haste em vista de produto final" },
    { "role": "product", "variantId": "haste", "src": "/products/final/sapata-lisa-quadrada-com-haste.png", "alt": "Sapata lisa quadrada com haste em vista de produto final" },
    { "role": "manual", "condition": { "pescoco": true }, "src": "/products/final/manual-sapata-lisa-quadrada-com-haste.png", "alt": "Sequência de instalação da sapata lisa quadrada com haste" },
    { "role": "usage", "condition": { "pescoco": true }, "src": "/products/final/uso-sapata-lisa-quadrada-com-haste.png", "alt": "Sapata lisa quadrada com haste aplicada em mobiliário" }
  ],
  "notes": ["Modelo paramétrico disponível para configuração."],
  "parameters": [
    { "key": "tamanhoBaseX", "label": "Tamanho base X", "type": "dimension", "unit": "mm", "min": 3, "max": 150, "step": 1, "default": 50, "role": "primary-width" },
    { "key": "tamanhoBaseY", "label": "Tamanho base Y", "type": "dimension", "unit": "mm", "min": 3, "max": 150, "step": 1, "default": 50, "role": "secondary-width" },
    { "key": "alturaBase", "label": "Altura da base", "type": "dimension", "unit": "mm", "min": 1, "max": 10, "step": 1, "default": 7, "role": "base-height" },
    { "key": "pescoco", "label": "Haste", "type": "boolean", "default": false, "role": "toggle" },
    { "key": "alturaPescoco", "label": "Altura da haste", "type": "dimension", "unit": "mm", "min": 5, "max": 35, "step": 1, "default": 12, "role": "neck-height", "dependsOn": "pescoco" },
    { "key": "diametroPescoco", "label": "Diâmetro da haste", "type": "dimension", "unit": "mm", "min": 3, "max": 15, "step": 1, "default": 8, "role": "neck-width", "dependsOn": "pescoco" }
  ],
  "variants": [
    {
      "id": "sem-haste",
      "code": "SH",
      "public": true,
      "condition": { "pescoco": false },
      "cad": {
        "script": "Produtos/Scripts-GH/Sapata_Lisa_Quadrada.gh",
        "modelVersion": "base-square-gh-v1",
        "sliderOrder": ["tamanhoBaseX", "tamanhoBaseY", "alturaBase"],
        "technicalDefaults": { "topChamferMm": 0.8, "baseBottomChamferMm": 0.6, "meshToleranceMm": 0.15 }
      },
      "pricing": {
        "surfaceId": "sapata-base-lisa:quadrada:sem-haste",
        "strategy": "sliced_dataset",
        "saleMultiplier": 4
      }
    },
    {
      "id": "haste",
      "code": "HA",
      "public": true,
      "condition": { "pescoco": true },
      "cad": {
        "script": "Produtos/Scripts-GH/Sapata_Lisa_Quadrada-com haste.gh",
        "modelVersion": "base-square-neck-gh-v1",
        "sliderOrder": ["tamanhoBaseX", "tamanhoBaseY", "alturaBase", "alturaPescoco", "diametroPescoco"],
        "technicalDefaults": { "topChamferMm": 0.8, "baseBottomChamferMm": 0.6, "meshToleranceMm": 0.15 }
      },
      "pricing": {
        "surfaceId": "sapata-base-lisa:quadrada:haste",
        "strategy": "sliced_dataset",
        "saleMultiplier": 4
      }
    }
  ]
}
