{
  "productId": "sapata-lisa-redonda",
  "status": "active",
  "name": "Lisa redonda",
  "description": "Para pés e bases com área circular de contato.",
  "category": { "slug": "sapata-base-lisa", "formatSlug": "redonda" },
  "seo": { "familySlug": "sapata-lisa-redonda" },
  "skuPrefix": "BF-BL-RD",
  "sku": {
    "versionMarker": "V2",
    "parameterOrder": ["diametro", "alturaBase", "alturaPescoco", "diametroPescoco"],
    "parameterCodes": {
      "diametro": "DI",
      "alturaBase": "AB",
      "alturaPescoco": "AP",
      "diametroPescoco": "DP"
    },
    "colorCodes": { "Preto": "PR", "Branco": "BR", "Cinza": "CZ", "Marrom": "MR" }
  },
  "material": "TPU",
  "colors": ["Preto", "Branco", "Cinza", "Marrom"],
  "finishes": [],
  "leadTimeBaseDays": 4,
  "generationMode": "local_manual",
  "drawingType": "base-round",
  "ui": {
    "fixation": "apoio plano",
    "summaryName": "Lisa redonda",
    "applications": ["poltronas", "sofás", "bases circulares"]
  },
  "visuals": [
    { "role": "family", "src": "/products/final/sapata-lisa-redonda-family.png", "alt": "Família de sapatas lisas redondas em diferentes medidas e cores" },
    { "role": "variations", "src": "/products/final/sapata-lisa-redonda-variados.png", "alt": "Variações de sapata lisa redonda com e sem haste" },
    { "role": "product", "variantId": "sem-haste", "src": "/products/final/sapata-lisa-redonda-sem-haste.png", "alt": "Sapata lisa redonda sem haste em vista de produto final" },
    { "role": "product", "variantId": "haste", "src": "/products/final/sapata-lisa-redonda-com-haste.png", "alt": "Sapata lisa redonda com haste em vista de produto final" },
    { "role": "manual", "condition": { "pescoco": true }, "src": "/products/final/manual-sapata-lisa-redonda-com-haste.png", "alt": "Sequência de instalação da sapata lisa redonda com haste" },
    { "role": "usage", "condition": { "pescoco": true }, "src": "/products/final/uso-sapata-lisa-redonda-com-haste.png", "alt": "Sapata lisa redonda com haste aplicada em mobiliário" }
  ],
  "notes": ["Modelo paramétrico disponível para configuração."],
  "parameters": [
    { "key": "diametro", "label": "Diametro", "type": "dimension", "unit": "mm", "min": 3, "max": 150, "step": 1, "default": 28, "role": "primary-width" },
    { "key": "alturaBase", "label": "Altura da base", "type": "dimension", "unit": "mm", "min": 1, "max": 10, "step": 1, "default": 6, "role": "base-height" },
    { "key": "pescoco", "label": "Haste", "type": "boolean", "default": false, "role": "toggle" },
    { "key": "alturaPescoco", "label": "Altura da haste", "type": "dimension", "unit": "mm", "min": 5, "max": 35, "step": 1, "default": 12, "role": "neck-height", "dependsOn": "pescoco" },
    { "key": "diametroPescoco", "label": "Diâmetro da haste", "type": "dimension", "unit": "mm", "min": 3, "max": 15, "step": 1, "default": 8, "role": "neck-width", "dependsOn": "pescoco" }
  ],
  "variants": [
    {
      "id": "sem-haste",
      "code": "SH",
      "public": true,
      "condition": { "pescoco": false },
      "cad": {
        "script": "Produtos/Scripts-GH/Sapata_Lisa_Redonda.gh",
        "modelVersion": "base-round-gh-v1",
        "sliderOrder": ["diametro", "alturaBase"],
        "technicalDefaults": { "topChamferMm": 0.8, "baseBottomChamferMm": 0.6, "meshToleranceMm": 0.15 }
      },
      "pricing": {
        "surfaceId": "sapata-base-lisa:redonda:sem-haste",
        "strategy": "sliced_dataset",
        "saleMultiplier": 4
      }
    },
    {
      "id": "haste",
      "code": "HA",
      "public": true,
      "condition": { "pescoco": true },
      "cad": {
        "script": "Produtos/Scripts-GH/Sapata_Lisa_Redonda-com Haste.gh",
        "modelVersion": "base-round-neck-gh-v1",
        "sliderOrder": ["diametro", "alturaBase", "alturaPescoco", "diametroPescoco"],
        "technicalDefaults": { "topChamferMm": 0.8, "baseBottomChamferMm": 0.6, "meshToleranceMm": 0.15 }
      },
      "pricing": {
        "surfaceId": "sapata-base-lisa:redonda:haste",
        "strategy": "sliced_dataset",
        "saleMultiplier": 4
      }
    }
  ]
}
