{
  "productId": "sapata-com-parafuso-quadrada",
  "status": "active",
  "name": "Com parafuso quadrada",
  "description": "Sapata quadrada sob medida com furo central técnico para fixação mecânica.",
  "category": { "slug": "sapata-com-parafuso", "formatSlug": "quadrada" },
  "seo": { "familySlug": "sapata-com-parafuso-quadrada" },
  "skuPrefix": "BF-SP-QD",
  "sku": {
    "versionMarker": "V2",
    "parameterOrder": ["tamanhoBaseX", "tamanhoBaseY", "alturaBase", "diametroParafuso"],
    "parameterCodes": { "tamanhoBaseX": "BX", "tamanhoBaseY": "BY", "alturaBase": "AB", "diametroParafuso": "PF" },
    "colorCodes": { "Preto": "PR", "Branco": "BR", "Cinza": "CZ", "Marrom": "MR" }
  },
  "material": "TPU",
  "colors": ["Preto", "Branco", "Cinza", "Marrom"],
  "finishes": [],
  "leadTimeBaseDays": 5,
  "generationMode": "local_manual",
  "manufacturing": {
    "screwClearance": {
      "sizeKeys": ["tamanhoBaseX", "tamanhoBaseY"],
      "screwDiameterKey": "diametroParafuso",
      "defaultScrewDiameterMm": 3,
      "countersinkDiameterFactor": 2,
      "minimumWallMm": 3
    }
  },
  "drawingType": "base-rect-screw",
  "ui": {
    "fixation": "parafuso central",
    "summaryName": "Com parafuso quadrada",
    "applications": ["cadeiras", "mesas", "poltronas", "bases quadradas"]
  },
  "visuals": [
    { "role": "family", "src": "/products/final/sapata-com-parafuso-quadrada-family.png", "alt": "Família de sapatas quadradas com furo central para parafuso em diferentes medidas e cores" },
    { "role": "product", "src": "/products/final/sapata-com-parafuso-quadrada-product.png", "alt": "Sapata quadrada com furo central para parafuso em vista de produto final" },
    { "role": "manual", "src": "/products/final/sapata-com-parafuso-quadrada-manual.png", "alt": "Sequência de instalação da sapata quadrada com parafuso separado" },
    { "role": "usage", "src": "/products/final/sapata-com-parafuso-quadrada-uso.png", "alt": "Sapata quadrada com parafuso aplicada sob pé de madeira" }
  ],
  "notes": ["O furo central acompanha o diâmetro configurado; o parafuso metálico não está incluso."],
  "parameters": [
    { "key": "tamanhoBaseX", "label": "Tamanho base X", "type": "dimension", "unit": "mm", "min": 12, "max": 150, "step": 1, "default": 50, "role": "primary-width" },
    { "key": "tamanhoBaseY", "label": "Tamanho base Y", "type": "dimension", "unit": "mm", "min": 12, "max": 150, "step": 1, "default": 50, "role": "secondary-width" },
    { "key": "alturaBase", "label": "Altura da base", "type": "dimension", "unit": "mm", "min": 1, "max": 10, "step": 1, "default": 7, "role": "base-height" },
    { "key": "diametroParafuso", "label": "Diâmetro do parafuso", "type": "dimension", "unit": "mm", "min": 2, "max": 10, "step": 0.5, "default": 3, "role": "fastener-diameter" }
  ],
  "variants": [
    {
      "id": "com-parafuso",
      "code": "CP",
      "public": true,
      "cad": {
        "script": "Produtos/Scripts-GH/Sapata_Lisa_Quadrada-com parafuso.gh",
        "modelVersion": "base-screw-square-gh-v1",
        "sliderOrder": ["tamanhoBaseX", "tamanhoBaseY", "alturaBase", "diametroParafuso"],
        "technicalDefaults": { "topChamferMm": 0.8, "baseBottomChamferMm": 0.6, "meshToleranceMm": 0.15, "screwCountersinkDiameterFactor": 2, "minimumRadialWallMm": 3 }
      },
      "pricing": { "surfaceId": "sapata-com-parafuso:quadrada:com-parafuso", "strategy": "sliced_dataset", "saleMultiplier": 4, "parameterKeys": ["tamanhoBaseX", "tamanhoBaseY", "alturaBase"] }
    }
  ]
}
