{
  "productId": "sapata-tubo-redondo",
  "status": "active",
  "name": "Tubo redondo",
  "description": "Para tubo redondo medido pelo diâmetro externo real e pela espessura da parede.",
  "category": { "slug": "ponteira-interna-tubo", "formatSlug": "redondo" },
  "seo": { "familySlug": "sapata-tubo-redondo" },
  "skuPrefix": "BF-RD-PI",
  "sku": {
    "versionMarker": "V2",
    "parameterOrder": ["diametroBase", "alturaBase", "alturaPescoco", "paredeTubo"],
    "parameterCodes": {
      "diametroBase": "DB",
      "alturaBase": "AB",
      "alturaPescoco": "AP",
      "paredeTubo": "PT"
    },
    "colorCodes": { "Preto": "PR", "Branco": "BR", "Cinza": "CZ", "Marrom": "MR" }
  },
  "material": "TPU",
  "colors": ["Preto", "Branco", "Cinza", "Marrom"],
  "finishes": [],
  "leadTimeBaseDays": 5,
  "generationMode": "local_manual",
  "manufacturing": {
    "tubeInnerSpan": {
      "sizeKeys": ["diametroBase"],
      "sizeOffsetsMm": {},
      "wallThicknessKey": "paredeTubo",
      "minimumMm": 5
    }
  },
  "drawingType": "tube-round",
  "ui": {
    "fixation": "press-fit interno",
    "summaryName": "Sapata interna tubo redondo",
    "applications": ["cadeiras", "mesas tubulares", "reposição"]
  },
  "visuals": [
    { "role": "family", "src": "/products/final/sapata-tubo-redondo-family.png", "alt": "Família de sapatas para tubo redondo em diferentes medidas e cores" },
    { "role": "product", "src": "/products/final/sapata-tubo-redondo-product.png", "alt": "Sapata para tubo redondo em vista de produto final" },
    { "role": "manual", "src": "/products/final/manual-sapata-tubo-redondo.png", "alt": "Sequência de instalação da sapata para tubo redondo" },
    { "role": "usage", "src": "/products/final/uso-sapata-tubo-redondo.png", "alt": "Sapata para tubo redondo aplicada em pé tubular" }
  ],
  "notes": ["Informe o diâmetro externo real do tubo; a parede determina o vão interno disponível."],
  "parameters": [
    { "key": "diametroBase", "label": "Diâmetro externo do tubo (Ø)", "type": "dimension", "unit": "mm", "min": 3, "max": 150, "step": 1, "default": 28, "role": "primary-width" },
    { "key": "alturaBase", "label": "Altura base", "type": "dimension", "unit": "mm", "min": 1, "max": 10, "step": 1, "default": 6, "role": "base-height" },
    { "key": "alturaPescoco", "label": "Altura pescoço", "type": "dimension", "unit": "mm", "min": 5, "max": 35, "step": 1, "default": 18, "role": "neck-height" },
    { "key": "paredeTubo", "label": "Parede tubo", "type": "dimension", "unit": "mm", "min": 0.8, "max": 8, "step": 0.1, "default": 1.5, "role": "wall-thickness" }
  ],
  "variants": [
    {
      "id": "sem-haste",
      "code": "SH",
      "public": true,
      "cad": {
        "script": "Produtos/Scripts-GH/Sapata_Interna_Tubo-Redondo.gh",
        "modelVersion": "tube-round-gh-v2",
        "sliderOrder": ["diametroBase", "alturaBase", "alturaPescoco", "paredeTubo"],
        "sliderTransforms": { "diametroBase": { "scale": 1, "offset": 10 } },
        "technicalDefaults": { "fitAllowanceMm": -0.2, "topChamferMm": 0.8, "baseBottomChamferMm": 0.6, "shoulderRadiusMm": 1.2, "meshToleranceMm": 0.15 }
      },
      "pricing": {
        "surfaceId": "ponteira-interna-tubo:redondo:sem-haste",
        "strategy": "sliced_dataset",
        "saleMultiplier": 1.7
      }
    }
  ]
}
